{
  "schemaVersion": 1,
  "engineVersion": 1,
  "id": "level-0029",
  "ordinal": 29,
  "orbitId": "orbit-01",
  "titlePt": "Cavidade funda",
  "familyId": "side-pockets",
  "learningTags": [
    "lip-open"
  ],
  "revision": 2,
  "authorNotes": "Authored candidate; difficulty and teaching intent await replay and human review.",
  "variants": {
    "easy": {
      "seedHex": "04739c77ea116f7c",
      "board": [
        {
          "r": 0,
          "c": 3,
          "kind": "color",
          "color": "blue"
        },
        {
          "r": 0,
          "c": 4,
          "kind": "color",
          "color": "blue"
        },
        {
          "r": 0,
          "c": 5,
          "kind": "color",
          "color": "blue"
        },
        {
          "r": 1,
          "c": 0,
          "kind": "color",
          "color": "purple"
        },
        {
          "r": 1,
          "c": 1,
          "kind": "color",
          "color": "purple"
        },
        {
          "r": 1,
          "c": 2,
          "kind": "color",
          "color": "purple"
        },
        {
          "r": 2,
          "c": 2,
          "kind": "color",
          "color": "green"
        },
        {
          "r": 2,
          "c": 3,
          "kind": "color",
          "color": "green"
        },
        {
          "r": 2,
          "c": 4,
          "kind": "color",
          "color": "green"
        },
        {
          "r": 2,
          "c": 5,
          "kind": "color",
          "color": "green"
        },
        {
          "r": 2,
          "c": 6,
          "kind": "color",
          "color": "green"
        }
      ],
      "objective": {
        "type": "clear_colors"
      },
      "maxShots": 10,
      "threeStarMaxShots": 5,
      "twoStarMaxShots": 7,
      "expectedMetrics": {
        "familyId": "side-pockets",
        "minBounces": 1
      }
    },
    "medium": {
      "seedHex": "8621fcf710f4577f",
      "board": [
        {
          "r": 0,
          "c": 3,
          "kind": "color",
          "color": "blue"
        },
        {
          "r": 0,
          "c": 4,
          "kind": "color",
          "color": "blue"
        },
        {
          "r": 0,
          "c": 5,
          "kind": "color",
          "color": "blue"
        },
        {
          "r": 1,
          "c": 0,
          "kind": "color",
          "color": "purple"
        },
        {
          "r": 1,
          "c": 1,
          "kind": "color",
          "color": "purple"
        },
        {
          "r": 1,
          "c": 2,
          "kind": "color",
          "color": "purple"
        },
        {
          "r": 2,
          "c": 2,
          "kind": "color",
          "color": "green"
        },
        {
          "r": 2,
          "c": 3,
          "kind": "color",
          "color": "green"
        },
        {
          "r": 2,
          "c": 4,
          "kind": "color",
          "color": "green"
        },
        {
          "r": 2,
          "c": 5,
          "kind": "color",
          "color": "green"
        },
        {
          "r": 2,
          "c": 6,
          "kind": "color",
          "color": "green"
        },
        {
          "r": 3,
          "c": 4,
          "kind": "color",
          "color": "orange"
        },
        {
          "r": 3,
          "c": 5,
          "kind": "color",
          "color": "orange"
        }
      ],
      "objective": {
        "type": "clear_colors"
      },
      "maxShots": 7,
      "threeStarMaxShots": 3,
      "twoStarMaxShots": 4,
      "expectedMetrics": {
        "familyId": "side-pockets",
        "minBounces": 1
      }
    },
    "hard": {
      "seedHex": "103254973934ccc1",
      "board": [
        {
          "r": 0,
          "c": 3,
          "kind": "color",
          "color": "blue"
        },
        {
          "r": 0,
          "c": 4,
          "kind": "color",
          "color": "blue"
        },
        {
          "r": 0,
          "c": 5,
          "kind": "color",
          "color": "blue"
        },
        {
          "r": 1,
          "c": 0,
          "kind": "color",
          "color": "purple"
        },
        {
          "r": 1,
          "c": 1,
          "kind": "color",
          "color": "purple"
        },
        {
          "r": 1,
          "c": 2,
          "kind": "color",
          "color": "purple"
        },
        {
          "r": 2,
          "c": 2,
          "kind": "color",
          "color": "green"
        },
        {
          "r": 2,
          "c": 3,
          "kind": "color",
          "color": "green"
        },
        {
          "r": 2,
          "c": 4,
          "kind": "color",
          "color": "green"
        },
        {
          "r": 2,
          "c": 5,
          "kind": "color",
          "color": "green"
        },
        {
          "r": 2,
          "c": 6,
          "kind": "color",
          "color": "green"
        },
        {
          "r": 3,
          "c": 4,
          "kind": "color",
          "color": "orange"
        },
        {
          "r": 3,
          "c": 5,
          "kind": "color",
          "color": "orange"
        },
        {
          "r": 4,
          "c": 3,
          "kind": "color",
          "color": "pink"
        },
        {
          "r": 4,
          "c": 4,
          "kind": "color",
          "color": "pink"
        },
        {
          "r": 4,
          "c": 5,
          "kind": "color",
          "color": "pink"
        },
        {
          "r": 4,
          "c": 6,
          "kind": "color",
          "color": "pink"
        }
      ],
      "objective": {
        "type": "clear_colors"
      },
      "maxShots": 5,
      "threeStarMaxShots": 3,
      "twoStarMaxShots": 4,
      "expectedMetrics": {
        "familyId": "side-pockets",
        "minBounces": 1
      }
    }
  }
}
