{
  "schemaVersion": 1,
  "engineVersion": 1,
  "id": "level-0021",
  "ordinal": 21,
  "orbitId": "orbit-01",
  "titlePt": "Escada cruzada",
  "familyId": "staircase",
  "learningTags": [
    "step-plan"
  ],
  "revision": 2,
  "authorNotes": "Authored candidate; difficulty and teaching intent await replay and human review.",
  "variants": {
    "easy": {
      "seedHex": "0eadd5b3cf9e83e7",
      "board": [
        {
          "r": 0,
          "c": 1,
          "kind": "color",
          "color": "blue"
        },
        {
          "r": 0,
          "c": 2,
          "kind": "color",
          "color": "blue"
        },
        {
          "r": 0,
          "c": 3,
          "kind": "color",
          "color": "blue"
        },
        {
          "r": 1,
          "c": 0,
          "kind": "color",
          "color": "purple"
        },
        {
          "r": 1,
          "c": 1,
          "kind": "color",
          "color": "purple"
        },
        {
          "r": 2,
          "c": 1,
          "kind": "color",
          "color": "green"
        },
        {
          "r": 2,
          "c": 2,
          "kind": "color",
          "color": "green"
        },
        {
          "r": 3,
          "c": 0,
          "kind": "color",
          "color": "purple"
        },
        {
          "r": 3,
          "c": 1,
          "kind": "color",
          "color": "purple"
        },
        {
          "r": 3,
          "c": 2,
          "kind": "color",
          "color": "purple"
        },
        {
          "r": 3,
          "c": 3,
          "kind": "color",
          "color": "purple"
        }
      ],
      "objective": {
        "type": "clear_colors"
      },
      "maxShots": 9,
      "threeStarMaxShots": 4,
      "twoStarMaxShots": 6,
      "expectedMetrics": {
        "familyId": "staircase",
        "minBounces": 0
      }
    },
    "medium": {
      "seedHex": "2c85794a93702b3c",
      "board": [
        {
          "r": 0,
          "c": 1,
          "kind": "color",
          "color": "blue"
        },
        {
          "r": 0,
          "c": 2,
          "kind": "color",
          "color": "blue"
        },
        {
          "r": 0,
          "c": 3,
          "kind": "color",
          "color": "blue"
        },
        {
          "r": 1,
          "c": 0,
          "kind": "color",
          "color": "purple"
        },
        {
          "r": 1,
          "c": 1,
          "kind": "color",
          "color": "purple"
        },
        {
          "r": 2,
          "c": 1,
          "kind": "color",
          "color": "green"
        },
        {
          "r": 2,
          "c": 2,
          "kind": "color",
          "color": "green"
        },
        {
          "r": 3,
          "c": 0,
          "kind": "color",
          "color": "purple"
        },
        {
          "r": 3,
          "c": 1,
          "kind": "color",
          "color": "purple"
        },
        {
          "r": 3,
          "c": 2,
          "kind": "color",
          "color": "purple"
        },
        {
          "r": 3,
          "c": 3,
          "kind": "color",
          "color": "purple"
        },
        {
          "r": 4,
          "c": 0,
          "kind": "color",
          "color": "orange"
        },
        {
          "r": 4,
          "c": 1,
          "kind": "color",
          "color": "orange"
        },
        {
          "r": 4,
          "c": 2,
          "kind": "color",
          "color": "orange"
        }
      ],
      "objective": {
        "type": "clear_colors"
      },
      "maxShots": 7,
      "threeStarMaxShots": 3,
      "twoStarMaxShots": 4,
      "expectedMetrics": {
        "familyId": "staircase",
        "minBounces": 0
      }
    },
    "hard": {
      "seedHex": "140c678b93b65256",
      "board": [
        {
          "r": 0,
          "c": 1,
          "kind": "color",
          "color": "blue"
        },
        {
          "r": 0,
          "c": 2,
          "kind": "color",
          "color": "blue"
        },
        {
          "r": 0,
          "c": 3,
          "kind": "color",
          "color": "blue"
        },
        {
          "r": 1,
          "c": 0,
          "kind": "color",
          "color": "purple"
        },
        {
          "r": 1,
          "c": 1,
          "kind": "color",
          "color": "purple"
        },
        {
          "r": 2,
          "c": 1,
          "kind": "color",
          "color": "green"
        },
        {
          "r": 2,
          "c": 2,
          "kind": "color",
          "color": "green"
        },
        {
          "r": 3,
          "c": 0,
          "kind": "color",
          "color": "purple"
        },
        {
          "r": 3,
          "c": 1,
          "kind": "color",
          "color": "purple"
        },
        {
          "r": 3,
          "c": 2,
          "kind": "color",
          "color": "purple"
        },
        {
          "r": 3,
          "c": 3,
          "kind": "color",
          "color": "purple"
        },
        {
          "r": 4,
          "c": 0,
          "kind": "color",
          "color": "orange"
        },
        {
          "r": 4,
          "c": 1,
          "kind": "color",
          "color": "orange"
        },
        {
          "r": 4,
          "c": 2,
          "kind": "color",
          "color": "orange"
        },
        {
          "r": 5,
          "c": 0,
          "kind": "color",
          "color": "pink"
        },
        {
          "r": 5,
          "c": 1,
          "kind": "color",
          "color": "pink"
        }
      ],
      "objective": {
        "type": "clear_colors"
      },
      "maxShots": 6,
      "threeStarMaxShots": 4,
      "twoStarMaxShots": 5,
      "expectedMetrics": {
        "familyId": "staircase",
        "minBounces": 0
      }
    }
  }
}
