{
  "schemaVersion": 1,
  "engineVersion": 1,
  "id": "level-0018",
  "ordinal": 18,
  "orbitId": "orbit-01",
  "titlePt": "Corredor largo",
  "familyId": "open-corridor",
  "learningTags": [
    "clear-bank"
  ],
  "revision": 2,
  "authorNotes": "Authored candidate; difficulty and teaching intent await replay and human review.",
  "variants": {
    "easy": {
      "seedHex": "f0f7bd77192e9768",
      "board": [
        {
          "r": 0,
          "c": 0,
          "kind": "color",
          "color": "blue"
        },
        {
          "r": 0,
          "c": 1,
          "kind": "color",
          "color": "blue"
        },
        {
          "r": 0,
          "c": 2,
          "kind": "color",
          "color": "blue"
        },
        {
          "r": 0,
          "c": 3,
          "kind": "color",
          "color": "blue"
        },
        {
          "r": 0,
          "c": 7,
          "kind": "color",
          "color": "blue"
        },
        {
          "r": 0,
          "c": 8,
          "kind": "color",
          "color": "blue"
        },
        {
          "r": 1,
          "c": 0,
          "kind": "color",
          "color": "purple"
        },
        {
          "r": 1,
          "c": 1,
          "kind": "color",
          "color": "purple"
        },
        {
          "r": 1,
          "c": 6,
          "kind": "color",
          "color": "purple"
        },
        {
          "r": 1,
          "c": 7,
          "kind": "color",
          "color": "purple"
        },
        {
          "r": 2,
          "c": 0,
          "kind": "color",
          "color": "green"
        },
        {
          "r": 2,
          "c": 1,
          "kind": "color",
          "color": "green"
        },
        {
          "r": 2,
          "c": 2,
          "kind": "color",
          "color": "green"
        },
        {
          "r": 2,
          "c": 3,
          "kind": "color",
          "color": "green"
        },
        {
          "r": 2,
          "c": 7,
          "kind": "color",
          "color": "green"
        },
        {
          "r": 2,
          "c": 8,
          "kind": "color",
          "color": "green"
        }
      ],
      "objective": {
        "type": "clear_colors"
      },
      "maxShots": 11,
      "threeStarMaxShots": 6,
      "twoStarMaxShots": 8,
      "expectedMetrics": {
        "familyId": "open-corridor",
        "minBounces": 0
      }
    },
    "medium": {
      "seedHex": "59bc6c3913c29985",
      "board": [
        {
          "r": 0,
          "c": 0,
          "kind": "color",
          "color": "blue"
        },
        {
          "r": 0,
          "c": 1,
          "kind": "color",
          "color": "blue"
        },
        {
          "r": 0,
          "c": 2,
          "kind": "color",
          "color": "blue"
        },
        {
          "r": 0,
          "c": 3,
          "kind": "color",
          "color": "blue"
        },
        {
          "r": 0,
          "c": 7,
          "kind": "color",
          "color": "blue"
        },
        {
          "r": 0,
          "c": 8,
          "kind": "color",
          "color": "blue"
        },
        {
          "r": 1,
          "c": 0,
          "kind": "color",
          "color": "purple"
        },
        {
          "r": 1,
          "c": 1,
          "kind": "color",
          "color": "purple"
        },
        {
          "r": 1,
          "c": 6,
          "kind": "color",
          "color": "purple"
        },
        {
          "r": 1,
          "c": 7,
          "kind": "color",
          "color": "purple"
        },
        {
          "r": 2,
          "c": 0,
          "kind": "color",
          "color": "green"
        },
        {
          "r": 2,
          "c": 1,
          "kind": "color",
          "color": "green"
        },
        {
          "r": 2,
          "c": 2,
          "kind": "color",
          "color": "green"
        },
        {
          "r": 2,
          "c": 3,
          "kind": "color",
          "color": "green"
        },
        {
          "r": 2,
          "c": 7,
          "kind": "color",
          "color": "green"
        },
        {
          "r": 2,
          "c": 8,
          "kind": "color",
          "color": "green"
        },
        {
          "r": 3,
          "c": 0,
          "kind": "color",
          "color": "orange"
        },
        {
          "r": 3,
          "c": 1,
          "kind": "color",
          "color": "orange"
        },
        {
          "r": 3,
          "c": 6,
          "kind": "color",
          "color": "orange"
        },
        {
          "r": 3,
          "c": 7,
          "kind": "color",
          "color": "orange"
        }
      ],
      "objective": {
        "type": "clear_colors"
      },
      "maxShots": 8,
      "threeStarMaxShots": 5,
      "twoStarMaxShots": 6,
      "expectedMetrics": {
        "familyId": "open-corridor",
        "minBounces": 0
      }
    },
    "hard": {
      "seedHex": "3db03fb664f1236d",
      "board": [
        {
          "r": 0,
          "c": 0,
          "kind": "color",
          "color": "blue"
        },
        {
          "r": 0,
          "c": 1,
          "kind": "color",
          "color": "blue"
        },
        {
          "r": 0,
          "c": 2,
          "kind": "color",
          "color": "blue"
        },
        {
          "r": 0,
          "c": 3,
          "kind": "color",
          "color": "blue"
        },
        {
          "r": 0,
          "c": 7,
          "kind": "color",
          "color": "blue"
        },
        {
          "r": 0,
          "c": 8,
          "kind": "color",
          "color": "blue"
        },
        {
          "r": 1,
          "c": 0,
          "kind": "color",
          "color": "purple"
        },
        {
          "r": 1,
          "c": 1,
          "kind": "color",
          "color": "purple"
        },
        {
          "r": 1,
          "c": 6,
          "kind": "color",
          "color": "purple"
        },
        {
          "r": 1,
          "c": 7,
          "kind": "color",
          "color": "purple"
        },
        {
          "r": 2,
          "c": 0,
          "kind": "color",
          "color": "green"
        },
        {
          "r": 2,
          "c": 1,
          "kind": "color",
          "color": "green"
        },
        {
          "r": 2,
          "c": 2,
          "kind": "color",
          "color": "green"
        },
        {
          "r": 2,
          "c": 3,
          "kind": "color",
          "color": "green"
        },
        {
          "r": 2,
          "c": 7,
          "kind": "color",
          "color": "green"
        },
        {
          "r": 2,
          "c": 8,
          "kind": "color",
          "color": "green"
        },
        {
          "r": 3,
          "c": 0,
          "kind": "color",
          "color": "orange"
        },
        {
          "r": 3,
          "c": 1,
          "kind": "color",
          "color": "orange"
        },
        {
          "r": 3,
          "c": 6,
          "kind": "color",
          "color": "orange"
        },
        {
          "r": 3,
          "c": 7,
          "kind": "color",
          "color": "orange"
        },
        {
          "r": 4,
          "c": 0,
          "kind": "color",
          "color": "pink"
        },
        {
          "r": 4,
          "c": 1,
          "kind": "color",
          "color": "pink"
        },
        {
          "r": 4,
          "c": 7,
          "kind": "color",
          "color": "pink"
        },
        {
          "r": 4,
          "c": 8,
          "kind": "color",
          "color": "pink"
        },
        {
          "r": 5,
          "c": 0,
          "kind": "color",
          "color": "cyan"
        },
        {
          "r": 5,
          "c": 1,
          "kind": "color",
          "color": "cyan"
        },
        {
          "r": 5,
          "c": 6,
          "kind": "color",
          "color": "cyan"
        },
        {
          "r": 5,
          "c": 7,
          "kind": "color",
          "color": "cyan"
        }
      ],
      "objective": {
        "type": "clear_colors"
      },
      "maxShots": 9,
      "threeStarMaxShots": 7,
      "twoStarMaxShots": 8,
      "expectedMetrics": {
        "familyId": "open-corridor",
        "minBounces": 0
      }
    }
  }
}
